Title,Company,Location,Type,Level,YearsExp,Country,Skills,MinYearsExp,MaxYearsExp
Junior Trader / Analyst,Cobblestone Energy Limited, Dubai,Full Time,Entry Level,0-4 Yrs of Exp,United Arab Emirates,"Energy, Mathematics, Python, Market Analysis, Statistics, Trading, Analyst/Research",0,4
Senior General Accountant,AL-FIKRY HOLDING, Sheikh Zayed,Full Time,Experienced,5-8 Yrs of Exp,Giza,"Accounting, Financial Analysis, English, Computer Skills, Microsoft Office, Financial Management, Accounting/Finance",5,8
Classroom Teacher - Foundation Stage 1,Al Bashaer International Schools, Maadi,Full Time,Experienced,2+ Yrs of Exp,Cairo,"Education, British Curriculum, English, Foundation Stage, Education/Teaching",2,4
Utilities Engineer,Arma, 10th of Ramadan City,Full Time,Experienced,2-5 Yrs of Exp,Cairo,"Mechanical Engineering, Maintenance, FMCG, English, Utilities, Engineering - Mechanical/Electrical",2,5
Export Sales & Logistics Specialist,Euro Van International, Nasr City,Full Time,Entry Level,1-3 Yrs of Exp,Cairo,"Sales Skills, Export, Logistics, MS Office, Communication Skills, Supply Chain, English, Business Administration, Sales Target",1,3
Body Paint Service Engineer,Confidential, Mansoura,Full Time,Experienced,3+ Yrs of Exp,Dakahlia,"English, Computer Skills, Microsoft Office, Body Paint, Automotive, Engineering - Mechanical/Electrical",3,5
Purchasing Coordinator,GIU- AS ( German International University of Applied Science ), New Capital,Full Time,Entry Level,0-2 Yrs of Exp,Cairo,"Procurement, Business Administration, Microsoft Excel, Microsoft Word, Administration, Purchasing/Procurement",0,2
Senior IT Specialist,American Mattress, Cairo,Full Time,Experienced,4+ Yrs of Exp,Egypt,"Computer Science, Maintenance, Repair, SQL, MS Dynamics NAV, POS Systems, AX Applications, Windows Server, Configure",4,6
English Technical Support Agent,Sykes Enterprises, Maadi,Full Time,Shift Based,1-3 Yrs of Exp,Cairo,"3 Vacancies, Technical Support, English, Customer Service, Computer Science, Windows XP, Apple OS, Customer Service/Support",1,3
Outdoor Sales Engineer- Cairo,Al Sarawat for Contracting and Supplies, Mokattam,Full Time,Entry Level,1-4 Yrs of Exp,Cairo,"Outdoor Sales, Sales Skills, Communication Skills, Presentation, Engineering, English, Microsoft Office, Sales Target, Management",1,4
Administrative & Operation Manager (Construction...,United Group For Engineering And Investment, Nasr City,Full Time,Manager,15-20 Yrs of Exp,Cairo,"Operations, Business Administration, Construction, Export, Planning, English, Communication Skills, MS Office, Administration",15,20
Senior Network Administrator,E3mel Business for Financial & Managerial Consultancy, Maadi,Full Time,Experienced,3-5 Yrs of Exp,Cairo,"Computer Science, Information Technology (IT), Network Administration, CCNP, CCNA, WAN, Networks, LAN, Security, Routers",3,5
Digital Marketing & Social Media Specialist,AL-FIKRY HOLDING, Sheikh Zayed,Full Time,Experienced,4-6 Yrs of Exp,Giza,"English, Computer Skills, Microsoft Office, Digital Marketing, Marketing/PR/Advertising, Media/Journalism/Publishing",4,6
Full stack Developer (PHP Codeigniter+ Angular...,Safa Soft, Maadi,Full Time,Experienced,4-10 Yrs of Exp,Cairo,"Software Development, Web Development, javaScript, PHP, JSON, MySQL, JQuery, Nosql, Node js, micro services, angular js",4,10
Sales Manager,Career Choice Consultancy, Nasr City,Full Time,Manager,2-4 Yrs of Exp,Cairo,"Sales Skills, Sales Target, Communication Skills, Business, Sales Strategies, Management, Customer Service, Customer Relationship",2,4
Office Manager,Confidential, Cairo,Full Time,Experienced,2-4 Yrs of Exp,Egypt,"Secretary, Administration, Office Management, Microsoft Office, Monitoring, Administration",2,4
Finance Manager,Venus For Trading and Supplies, Badr City,Full Time,Manager,12-15 Yrs of Exp,Cairo,"Retail, Finance, Accounting, Financial Management, Financial Analysis, Accounting/Finance",12,15
Outdoor Sales Representative,World Business Fitness, New Cairo,Full Time,Experienced,3-4 Yrs of Exp,Cairo,"Outdoor Sales, Sales Target, Marketing, Travel, Leads, Customer Service/Support, Sales/Retail",3,4
Draftman,AluNile, Mohandessin,Full Time,Entry Level,1-2 Yrs of Exp,Giza,"AutoCAD, Revit, Engineering, Architecture, Auto CAD, Creative/Design/Art",1,2
GL Accountant,Cairoscan, Mohandessin,Full Time,Experienced,2-5 Yrs of Exp,Giza,"Microsoft Office, Microsoft Excel, Finance, Commerce, Financial Management, Financial Analysis, Computer Skills, GL, General Ledger",2,5
Pharma Sales Representative,World Business Fitness, New Cairo,Full Time,Experienced,3-4 Yrs of Exp,Cairo,"Medical, Pharmaceutical, Negotiation, Communication, Sales/Retail, Pharmaceutical",3,4
Front Desk Receptionist- Night Shift,Al fawzy dental, Agouza,Full Time,Experienced,2-3 Yrs of Exp,Giza,"Administration, Office Management, English, Communication, Microsoft Office, Administration, Customer Service/Support",2,3
Pharma Tele-Sales Representative,World Business Fitness, Cairo,Full Time,Experienced,3-4 Yrs of Exp,Egypt,"Customer Support, Sales Skills, Sales Target, Pharmaceutical, Sales/Retail, Pharmaceutical",3,4
Senior Full Stack Java Developer,Confidential, Cairo,Part Time,Work From Home,3-4 Yrs of Exp,Egypt,"2 Vacancies, Agile, Angular, Information Technology (IT), Computer Science, Software Development, javaScript, Docker, NodeJS",3,4
Technical Consultant,Ultimate Solutions Egypt, 6th of October,Full Time,Entry Level,0-2 Yrs of Exp,Giza,"Software, banking, technical support, Java, C++, Programming, Computer Science, Information Technology (IT), Oracle, XML, IT",0,2
Sybase Database Administrator,ITS, Cairo,Full Time,Experienced,2+ Yrs of Exp,Egypt,"Databases, Sybase Database Administration, MySQL, Oracle, Performance Tuning, Sybase ASE, Sybase IQ, IT/Software Development",2,4
Foreign Purchasing Specialist,Confidential, 6th of October,Full Time,Entry Level,0-2 Yrs of Exp,Giza,"Procurement, English, Microsoft Office, Supply Chain, Logistics, Shipping, Purchasing/Procurement",0,2
Quality Control Inspector - Wood & Metal,Hanimex, Obour City,Full Time,Experienced,3-5 Yrs of Exp,Cairo,"Quality Control, Furniture, Audit, Production, Quality Assurance, QA, Wood Inspection, Metal Inspection, Manufacturing/Production, Quality",3,5
Planning & follow up Manager,Hanimex, Obour City,Full Time,Manager,6-9 Yrs of Exp,Cairo,"Supply Chain, Microsoft Office, Logistics, Shipping, Material Planning, Production Planning, Raw Material, Logistics/Supply Chain",6,9
Sales And Marketing Specialist - Females Only,Pure Facilities, Giza,Full Time,Work From Home,1-3 Yrs of Exp,Egypt,"Females Only, Sales Skills, Marketing, Sales Target, Advertising, Publicity, Media, Marketing/PR/Advertising, Sales/Retail",1,3
Social Media Designer,Egypt Yellow Pages, Maadi,Full Time,Entry Level,1-3 Yrs of Exp,Cairo,"Adobe Illustrator, Graphic Design, Adobe Photoshop, After Effects, Creative/Design/Art, Marketing/PR/Advertising",1,3
Software QC Tester,Ithmaar Integrated Solutions, Giza,Full Time,Entry Level,1-3 Yrs of Exp,Egypt,"Computer Science, Information Technology (IT), QC, QA, Automation, Software Development, Performance Testing, Computer Engineering",1,3
Operations Auditor,Mishkat Nour, Nasr City,Full Time,Experienced,3-7 Yrs of Exp,Cairo,"Auditing, Operations, Financial Analysis, Accounting, Finance, Computer Skills, Accounting/Finance, Operations/Management",3,7
Java Backend Developer (Spring/ADF),Ithmaar Integrated Solutions, Haram,Full Time,Experienced,2-4 Yrs of Exp,Giza,"Java, Software Development, Information Technology (IT), ADF, Software Engineering, Back-End, Spring Boot, J2EE, Hibernate",2,4
Java Engineer,siParadigm Egypt, Sheraton,Full Time,Experienced,2-4 Yrs of Exp,Cairo,"Software Development, Java, Information Technology (IT), Computer Science, MYSQL, Linux, J2EE, Angular 6, Spring Boot, PostgreSQL",2,4
Senior Angular Developer,Generation C, Nasr City,Full Time,Experienced,3+ Yrs of Exp,Cairo,"Angular, Computer Science, Software Development, javaScript, Git, Engineering, Information Technology (IT), Telecom, jQuery",3,5
Warehouse Manager - Mit Ghamr (Pharmacist),Ibn Sina Pharma, Mit Ghamr,Full Time,Manager,0-2 Yrs of Exp,Dakahlia,"Warehouse Manager, Pharmacy, Pharmaceutical Sciences, Logistics, Supply Chain, Lean Warehouse, Six Sigma, Management, Administration",0,2
Telesales Manager,Confidential, Hadayek Alahram,Full Time,Manager,4+ Yrs of Exp,Giza,"Telesales, Customer Service, Sales Target, Software, Zoho, Microsoft Office, Sales Skills, English, Management, Customer Service/Support",4,6
Sales Engineer - Kitchens,Confidential, Maadi,Full Time,Experienced,2-5 Yrs of Exp,Cairo,"3DMAX, AutoCAD, Graphic Design, Architecture, Construction, Applied Arts, Interior Design, Architectural, Technical Support",2,5
Blogger / Content Writer (Internship),Businessita Women Empowerment, Cairo,Internship,Student,0-1 Yrs of Exp,Egypt,"Editing, Writing Skills, Media, Content Writing, Content Development, Arabic, English, Blogging, Writing/Editorial",0,1
Full Stack Developer Angular & Java ( R&D ),Cegedim, New Cairo,Full Time,Experienced,2+ Yrs of Exp,Cairo,"Information Technology (IT), Java, Computer Science, Computer Engineering, Software Engineering, System Design, Data Structure, TDD",2,4
Graphic Designer - Internship,Businessita Women Empowerment, Cairo,Internship,Student,0-1 Yrs of Exp,Egypt,"Creativity, Adobe Photoshop, Adobe Illustrator, Internship, Creative/Design/Art",0,1
Receptionist and Customer Service Representative,Confidential, Maadi,Full Time,Entry Level,1-3 Yrs of Exp,Cairo,"Retail, Show Room, Customer Service, Customer Care, Furniture Sales, Customer Support, AdministrationA, Admin Work, Administration",1,3
Branch Manager - Nasr City,4level1, Nasr City,Full Time,Manager,2-3 Yrs of Exp,Cairo,"Customer Service, Branch Management, Administration, Communication, Retail, Customer Service/Support, Operations/Management, Sales/Retail",2,3
Web Developer,Yis Web, Sheikh Zayed,Full Time,Experienced,3-5 Yrs of Exp,Giza,"Computer Science, Web Development, Software Development, javaScript, HTML, PHP, CSS, Git, MySQL, AJAX, Design",3,5
Fashion Designer,Hala Garments, Agouza,Full Time,Experienced,2-4 Yrs of Exp,Giza,"Design, Adobe Photoshop, Adobe Illustrator, Creative, Clothing, Trends, Crafts, Creative/Design/Art, Fashion",2,4
Android Developer,Yis Web, Sheikh Zayed,Full Time,Experienced,3-5 Yrs of Exp,Giza,"Computer Science, Software Development, Git, Android SDK, UI, Design, RESTful APIs, IT/Software Development",3,5
Full Stack .Net Software Developer,Confidential, Heliopolis,Full Time,Experienced,2-5 Yrs of Exp,Cairo,"Microsoft.Net, C#, Website Development, CSS, HTML5, SEO, Windows Server, Software Development, IIS, XML, MySQL, jQuery",2,5
UI/UX Designer,Yis Web, Sheikh Zayed,Full Time,Experienced,2-5 Yrs of Exp,Giza,"UI, UX, Computer Science, Design, Sketch, Illustrator, Android, User Interface, Wireframes, XD, Web, iOS",2,5
iOS Mobile Developer,Yis Web, Sheikh Zayed,Full Time,Experienced,3-5 Yrs of Exp,Giza,"Information Technology (IT), iOS, Software Development, Mobile Development, APIs, App Store, Swift, cocoa, Core Animation",3,5
English Instructors - Online,SYE English Community, Nasr City,Part Time,Freelance / Project,1+ Yrs of Exp,Cairo,"1+ Yrs of Exp, 5 Vacancies, Education, English Teaching, Professional Teaching Certificate, Instructing, Training",1,3
Technical Office Engineer (Applied Arts or Fine...,Lotus Finishing Materials, Nozha,Full Time,Experienced,2-3 Yrs of Exp,Cairo,"Technical Office, MS Office, Applied Arts, Communication Skills, Microsoft Office, English, Engineering, 3D, Fine Arts, Architecture",2,3
Medical Representative,Confidential, Cairo,Full Time,Entry Level,0-2 Yrs of Exp,Egypt,"Sales Skills, Medical, Representative, pharmaceutical, Sales Target, Veterinary, Science, Biochemistry, Biology, Medical/Healthcare",0,2
Telesales Representative - US Account,PROJECS, Sheikh Zayed,Full Time,Entry Level,1+ Yrs of Exp,Giza,"Sales Skills, Customer Support, Customer Care, Telesales, English, Customer Service, Telemarketing, Call Center, Sales/Retail",1,3
Marketing Manager,4level1, Maadi,Full Time,Manager,10-15 Yrs of Exp,Cairo,"Sales, Digital Marketing, Market Research, SEO, Online Marketing, Advertising, Brand management, Marketing/PR/Advertising",10,15
Store Manager,Jollyland, Cairo,Full Time,Manager,3+ Yrs of Exp,Egypt,"Retail, Store Management, Sales Skills, Fashion, Customer Service, Store Manager, Business, Customer Service/Support, Sales/Retail",3,5
Senior Software Engineer Backend (PHP),Togar, New Nozha,Full Time,Experienced,3-7 Yrs of Exp,Cairo,"PHP, Information Technology (IT), Software Development, CSS, Computer Science, javaScript, MySQL, HTML, OOP, AJAX, WordPress",3,7
Senior Instructional Designer,Nahdet Misr Publishing Group, Mohandessin,Full Time,Experienced,3-7 Yrs of Exp,Giza,"ITI, English, Articulate, Creative/Design/Art",3,7
Business Development Specialist,Talent 360, Cairo,Full Time,Entry Level,1-3 Yrs of Exp,Egypt,"Sales Skills, Marketing, Sales Target, Communication Skills, Business Development, Marketing/PR/Advertising",1,3
Lawyer,Confidential, Cairo,Full Time,Part Time,5-15 Yrs of Exp,Egypt,"5 Vacancies, Legal, Microsoft Office, Law Firm, Legal",5,15
Graphic Designer,Estabraq, Nasr City,Full Time,Experienced,2-6 Yrs of Exp,Cairo,"Graphic Design, Adobe Photoshop, Adobe Illustrator, InDesign, Adobe Creative Suite, Creative/Design/Art",2,6
Showroom Sales Assistant,Estabraq, Madinaty,Full Time,Experienced,2-4 Yrs of Exp,Cairo,"Showroom Sales, Retail Sales, Fashion, Customer Service, Customer Service/Support, Sales/Retail, Fashion",2,4
Sales Engineer,3Brothers, Heliopolis,Full Time,Entry Level,1-2 Yrs of Exp,Cairo,"Sales Skills, Electrical Power Engineering, Microsoft Office, Electrical Engineering, Sales Target, Communication Skills, MS Office",1,2
Surveillance Operator - Tanta,Town Team, Tanta,Full Time,Experienced,2+ Yrs of Exp,Gharbia,"Admin, CCTV, Surveillance Systems, Installation/Maintenance/Repair, Engineering - Telecom/Technology",2,4
Front End Developer,Genify.ai, Cairo,Full Time,Work From Home,1-2 Yrs of Exp,Egypt,"HTML5, CSS3, Ionic, Angular, React Native, Git, UI, UI/UX, Python, Information Technology (IT), Computer Science, javaScript",1,2
BI-Data Analyst,AQARITO, Maadi,Full Time,Part Time,1-3 Yrs of Exp,Cairo,"Computer Science, Power BI, SQL, BI, Data Analytics, Business Data, English, Database, Data Analysis, Business Development",1,3
Receiving Specialist,Maxab, Cairo,Full Time,Shift Based,0-1 Yrs of Exp,Egypt,"4 Vacancies, MS Office, Logistics, Supply Chain, Purchasing, Procurement, Warehousing, Logistics/Supply Chain",0,1
Graphic Designer,Arabic Trader, Dokki,Full Time,Entry Level,1+ Yrs of Exp,Giza,"Adobe Illustrator, Adobe Indesign, Adobe Photoshop, Applied Arts, Web Design, HTML, CSS, javaScript, Fine Arts, Social Media",1,3
Sales Supervisor - German Speaker,idaco, 6th of October,Full Time,Experienced,6+ Yrs of Exp,Giza,"Sales Skills, German, Sales Target, Sales/Retail",6,8
Indoor Sales Representative,Smart GYM, Nasr City,Full Time,Entry Level,1-2 Yrs of Exp,Cairo,"Customer Service, Customer Care, Selling Skills, Customer Support, Indoor Sales, Sales Target, Customer Service/Support, Sales/Retail",1,2
Supply Chain Manager,Confidential, Obour City,Full Time,Manager,15+ Yrs of Exp,Cairo,"Supply Chain, Food and Beverage, AX, CSCP, Logistics, Commerce, CPIM, Logistics/Supply Chain, Purchasing/Procurement",15,17
Accountant,Insitu Egypt, Maadi,Full Time,Experienced,2+ Yrs of Exp,Cairo,"Finance, Financial Analysis, Warehouse manager, Financial Management, Communication Skills, Accounting/Finance",2,4
IT System Administrator - Minya,UD Crops, New Menia,Full Time,Experienced,2-4 Yrs of Exp,Minya,"Information Technology (IT), CCNA, System Administration, Security, Computer Science, Installation/Maintenance/Repair",2,4
Reservation Agent (Hotels) - Alexandria,Paradise Inn Hotels & Resorts, Mahta Alraml,Full Time,Experienced,3+ Yrs of Exp,Alexandria,"Ticketing, Customer Service, Customer Care, Customer Support, Hotels, Fidelio Suite 8, Travel, Tourism, Hospitality, Booking",3,5
Photographer / Filmmaker,ArabAps, Nasr City,Full Time,Experienced,2-4 Yrs of Exp,Cairo,"Films, Videos, Photography, Videography, Filmmaking, English, Travel, E-marketing, Creative/Design/Art, Media/Journalism/Publishing",2,4
Graphic Designer,EHG Group, New Cairo,Full Time,Experienced,5+ Yrs of Exp,Cairo,"Adobe Photoshop, Adobe Illustrator, Creative/Design/Art",5,7
Courier,DHL Express Egypt, Cairo,Full Time,Entry Level,1-3 Yrs of Exp,Egypt,"Males Only, Courier, Logistics, Supply Chain, Operations, Delivery, Production, Support, Logistics/Supply Chain",1,3
Mechanical Maintenance Engineer,Confidential, Sheraton,Full Time,Experienced,5-6 Yrs of Exp,Cairo,"Maintenance, Mechanical Engineering, Technical, Installation/Maintenance/Repair, Engineering - Mechanical/Electrical",5,6
Architecture Site Engineer,El-Alameya for Engineering and Project Management, Cairo,Full Time,Experienced,3-5 Yrs of Exp,Egypt,"AutoCAD, Architecture, Design, Construction, Engineering - Construction/Civil/Architecture",3,5
Sales Representative,Aircomfort company(Plac-viva), New Cairo,Full Time,Experienced,3+ Yrs of Exp,Cairo,"Sales Target, Sales Skills, Customer Service, Sales/Retail",3,5
Production Manager - Cotton Socks,Aircomfort company(Plac-viva), New Cairo,Full Time,Manager,3+ Yrs of Exp,Cairo,"Operations, Management, Cotton, QA, QC, Quality Control, Quality Assurance, Operations/Management, Manufacturing/Production",3,5
Technical Office Engineer - Architecture,El-Alameya for Engineering and Project Management, Mohandessin,Full Time,Experienced,5-10 Yrs of Exp,Giza,"Computer Skills, Microsoft Office, Microsoft Word, Microsoft Excel, Architecture, AutoCAD, Technical Office, English",5,10
Membership Advisor (Sales) - Giza,The Science Gym, Giza,Full Time,Entry Level,1-3 Yrs of Exp,Egypt,"Sales Skills, Sales Target, Fitness, Club, Membership, Gym, Sales/Retail, Sports and Leisure",1,3
Social Media Expert,Insitu Egypt, Maadi,Part Time,Freelance / Project,1+ Yrs of Exp,Cairo,"1+ Yrs of Exp, Communication Skills, E-marketing, Facebook, Social Media Channels, English, Content, Arabic",1,3
Accountant,Confidential, New Cairo,Full Time,Experienced,2-3 Yrs of Exp,Cairo,"Microsoft Excel, Finance, Financial Analysis, Financial Management, Accountant, MS Excel, Pivot, Accounting Regulations",2,3
General Accountant - Beni Suef,PENCILIGHT, Beni Suef,Full Time,Entry Level,0-6 Yrs of Exp,Beni Suef,"Manufacturing, Accounting, Commerce, Quickbooks, Bookkeeping, English, Arabic, Procurement, Finance, Accounting/Finance",0,6
Head of KG Department,Prime International School, Cairo,Full Time,Manager,7+ Yrs of Exp,Egypt,"Education, Teaching, KG, Montessori, Operations/Management, Education/Teaching",7,9
Treasury Accountant,Confidential, Nasr City,Full Time,Entry Level,1-3 Yrs of Exp,Cairo,"Finance, Treasury Accounting, Commerce, Accounting/Finance",1,3
Project Coordinator - Giza,Al Arab Group, Sheikh Zayed,Full Time,Experienced,2-7 Yrs of Exp,Giza,"Administration, Project Coordination, English, Arabic, Administration, Project/Program Management",2,7
Administrative Manager,Al Arab Group, Sheikh Zayed,Full Time,Manager,2-6 Yrs of Exp,Giza,"Office Management, Microsoft Office, Administration, Operations/Management",2,6
Front End Developer ( Angular ),Artapart, Maadi,Full Time,Experienced,2-3 Yrs of Exp,Cairo,"Information Technology (IT), Computer Science, Software Development, javaScript, CSS, Git, SASS, Design, Redux, OOP, React",2,3
Quality Assurance /Control Engineer,Gulsan Egypt Non-Woven Industries, 6th of October,Full Time,Entry Level,0-3 Yrs of Exp,Giza,"Quality Control, Quality Assurance, Engineering, Chemistry, Textile Engineer, Industrial Engineer, QA, QC, English, TO, Quality",0,3
Senior Sales Executive,DM Arts, Cairo,Full Time,Experienced,3+ Yrs of Exp,Egypt,"Advertising, Lead Generation, Media, Sales Skills, Customer Service, Client Relations, Digital Marketing, Training",3,5
Junior Property Consultant,Triumph Estate Group, Heliopolis,Full Time,Entry Level,1-2 Yrs of Exp,Cairo,"Sales Skills, Customer Service, Microsoft Office, English, Communication Skills, Brokerage, Sales Target, Real Estate, Sales/Retail",1,2
Senior Site Architect,Asass, New Cairo,Full Time,Experienced,5-8 Yrs of Exp,Cairo,"Project Management, Residential, Commercial Projects, Engineering, Site, Finishing, Engineering - Construction/Civil/Architecture",5,8
Logistics Operations Specialist,Transcesion VC, Mohandessin,Full Time,Experienced,3-5 Yrs of Exp,Giza,"Operations, Shipping, E-Commerce, Orders, Fleet Management, Computer Skills, Logistics/Supply Chain, Operations/Management",3,5
Senior Sales Representative,Anasia Egypt for Trading, Sheraton,Full Time,Experienced,3-5 Yrs of Exp,Cairo,"Cisco, Sales Skills, Sales Target, English, Arabic, Sales/Retail",3,5
Senior Property Consultant,Triumph Estate Group, Heliopolis,Full Time,Experienced,2-4 Yrs of Exp,Cairo,"Sales Skills, Sales Target, Brokerage, Real Estate, Communication Skills, Microsoft Office, English, Customer Service/Support",2,4
Admin Coordinator,Engosoft, Nasr City,Full Time,Entry Level,1-3 Yrs of Exp,Cairo,"Administration, Microsoft Office, English, Communication Skills, Excel, Photoshop, Office Management, Administration",1,3
Document Controller / Data Entry Agent,Transcesion VC, Mohandessin,Full Time,Experienced,2-4 Yrs of Exp,Giza,"Administration, Microsoft Office, MS Office, Document Control, Administration",2,4
Claims Auditor - Giza,Cleopatra Hospitals Group, Mohandessin,Full Time,Entry Level,1-3 Yrs of Exp,Giza,"Medical Audits, Finance, Medicine, Financial Analysis, Accounting/Finance, R&D/Science, Medical/Healthcare",1,3
Projects Sales Leader,Saint-Gobain, Cairo,Full Time,Manager,3-5 Yrs of Exp,Egypt,"Sales Target, Exterior Finishing Solutions, Interior Finishing Solutions, Plaster Boards, Ceiling Tiles, Constructions Chemicals",3,5
Chemical Engineer - Lab Quality Engineer,Intrade, Cairo,Full Time,Experienced,3+ Yrs of Exp,Egypt,"R&D, Research & Development, Chemistry, Quality Assurance, Chemical Engineer, Coating Systems, Paint and Coating, Engineering",3,5
Digital Marketing Content Creator,BICC Services Worldwide, Nasr City,Full Time,Experienced,2+ Yrs of Exp,Cairo,"English, Digital Marketing Content Creation, Writing/Editorial, Marketing/PR/Advertising, Media/Journalism/Publishing",2,4
Junior Digital Marketing Content Creator,BICC Services Worldwide, Nasr City,Full Time,Entry Level,0-1 Yrs of Exp,Cairo,"English, Digital Marketing Content Creation, Writing/Editorial, Marketing/PR/Advertising, Media/Journalism/Publishing",0,1
Marketing Manager,Confidential, Heliopolis,Full Time,Manager,5+ Yrs of Exp,Cairo,"Sales, Marketing Strategy, Marketing Plan, Marketing Campaign, Real Estate, Market Research, Marketing/PR/Advertising",5,7
Senior PHP Developer,Confidential, Cairo,Full Time,Experienced,5+ Yrs of Exp,Egypt,"PHP, Computer Science, Software Development, MVC, Laravel, Programming, IT/Software Development",5,7
Senior Planning Engineer - Architecture,El-Alameya for Engineering and Project Management, Dokki,Full Time,Experienced,5-10 Yrs of Exp,Giza,"BIM, Primavera P6, English, Cost control, Civil Engineering, Architecture, Project Management, Planning Engineer, CPM scheduling",5,10
Key Account Manager (Media Storage),Allamna Integrated Solutions, Heliopolis,Full Time,Manager,4-6 Yrs of Exp,Cairo,"Business Administration, Media Storage, Microfilm, Account Management, Sales/Retail, Media/Journalism/Publishing",4,6
Electrical Tendering Engineer,Tantamotors company, Nasr City,Full Time,Experienced,3-5 Yrs of Exp,Cairo,"Tendering, Purchasing, Procurement, Engineering - Mechanical/Electrical",3,5
Mechanical Tendering Engineer,Tantamotors company, Nasr City,Full Time,Experienced,3-5 Yrs of Exp,Cairo,"Tendering, Microsoft Office, Purchasing, Procurement, Engineering - Mechanical/Electrical",3,5
Project Coordinator,Confidential, Maadi,Full Time,Experienced,2+ Yrs of Exp,Cairo,"Petrol, Oil & Gas, Mechanical Engineering, Project Management, Production, Project/Program Management, Engineering - Mechanical/Electrical",2,4
Presentation & Graphic Designer,MigrationIT.com, Cairo,Full Time,Experienced,3-5 Yrs of Exp,Egypt,"Adobe Illustrator, Adobe Photoshop, Adobe Creative Cloud, Video Editing, Prezi, Acrobat Pro, Creative/Design/Art",3,5
Digital Marketing Executive,Confidential, Nasr City,Full Time,Experienced,3-5 Yrs of Exp,Cairo,"Digital Marketing, Social Media, Digital Media, Marketing/PR/Advertising, Media/Journalism/Publishing",3,5
Software Developer - Experienced,HITS Technologies, Nasr City,Full Time,Experienced,3-6 Yrs of Exp,Cairo,"Information Technology (IT), Computer Science, Computer Engineering, Integration, Software Development, Software Engineering, JSON",3,6
Junior QC Engineer,Flairstech, Maadi,Full Time,Entry Level,0-1 Yrs of Exp,Cairo,"Quality Control, English, Testing, Software, Computer Engineering, Computer Science, Information Technology (IT), API, QA, SQL",0,1
System Engineer (Microsoft),Confidential, Cairo,Full Time,Experienced,3-8 Yrs of Exp,Egypt,"Computer Science, Microsoft Office, Telecom Engineering, Office365, Azure, AWS, Networking, Linux, SQL",3,8
Senior Sales Specialist,NowPay, Downtown,Full Time,Manager,5-10 Yrs of Exp,Cairo,"Sales Skills, Sales Target, Indoor Sales, Marketing, Economics, Business Administration, Arabic, English, Excel, MS Office, Sales Plan",5,10
Senior Software Sales Specialist,Expand Cart, 6th of October,Full Time,Experienced,2+ Yrs of Exp,Giza,"Sales Skills, Selling Skills, Sales Target, B2B Sales, Corporate Sales, CRM, Computer Science, Information Technology (IT), IT Sales",2,4
System Engineer (VMware),Confidential, Cairo,Full Time,Experienced,3-8 Yrs of Exp,Egypt,"Computer Science, Computer Engineering, Cloud Management, VMWare, Linux, VSphere, Virtualization, Infrastructure",3,8
