Title,Company,Location,Type,Level,YearsExp,Country,Skills,MinYearsExp,MaxYearsExp
Credit Control Specialist,MTS Logistics, Cairo,Full Time,Experienced,3-6 Yrs of Exp,Egypt,"Accounting, Credit Control, Microsoft Office, Accounting/Finance",3,6
Sales Accountant - Damietta,EGIC, Damietta,Full Time,Entry Level,0-3 Yrs of Exp,Egypt,"Finance, Sales Accounting, Commerce, Budget, Reporting, Accounting/Finance",0,3
Sales Accountant - Dakahlia,EGIC, Dakahlia,Full Time,Entry Level,0-3 Yrs of Exp,Egypt,"Finance, Sales Accounting, Commerce, Budget, Reporting, Accounting/Finance",0,3
Senior Sales Representative Real Estate,Next Home For Real Estate, New Cairo,Full Time,Experienced,2-5 Yrs of Exp,Cairo,"Females Preferred, Real Estate, Sales Target, Communication Skills, Presentation Skills, Negotiation Skills, Sales Skills, broker",2,5
IT Manager,Ameco Medical Industries, 10th of Ramadan City,Full Time,Manager,8+ Yrs of Exp,Sharqia,"Software Development, Software Engineering, Computer Science, Manufacturing, ERP, CRM, Infrastructure, SCM, Medical",8,10
Junior Legal Advisor,Alumil, Heliopolis,Full Time,Entry Level,1+ Yrs of Exp,Cairo,"Law, Legal, Governmental Affairs, English, Legal",1,3
Fulfillment Point Manager,Breadfast, Cairo,Full Time,Manager,3+ Yrs of Exp,Egypt,"Hub, Fulfillment Center, Inventory, Operations, Logistics, Supply Chain, Order fulfillment, Management, Leadership, Communication",3,5
Sales Accountant - Beheira,EGIC, Beheira,Full Time,Entry Level,0-3 Yrs of Exp,Egypt,"Finance, Sales Accounting, Commerce, Budget, Reporting, Accounting/Finance",0,3
Business Analyst,Brandshub.co, Mohandessin,Full Time,Entry Level,1-3 Yrs of Exp,Giza,"Economics, Business Administration, Statistics, English, Excel, Business Development, Pricing, Sales, Business Development",1,3
Senior Software Developer (.Net Core + React JS),CrossWorkers, Cairo,Full Time,Experienced,3+ Yrs of Exp,Egypt,"Information Technology (IT), Computer Science, Software Development, HTML, Full Stack, Software Engineering, C#, SQL, ReactJS",3,5
Sales Accountant - Suez,EGIC, Suez,Full Time,Entry Level,1-3 Yrs of Exp,Egypt,"Finance, Sales Accounting, Commerce, Budget, Reporting, Accounting/Finance",1,3
Accountant - Alexandria,Egaz, Alexandria,Full Time,Experienced,5+ Yrs of Exp,Egypt,"Accounting, Finance, Financial Analysis, Financial Management, Microsoft Office, Excel, Pharmaceutical, Word, Accounting/Finance",5,7
Executive Secretary / Pharmaceutical Industry -...,Egaz, Alexandria,Full Time,Experienced,10+ Yrs of Exp,Egypt,"Administration, Office Management, ICDL, E-marketing, English, Pharmaceutical, Administration",10,12
Operations Manager - Alexandria,Egaz, Alexandria,Full Time,Manager,5+ Yrs of Exp,Egypt,"Operations, Management, Logistics, E-marketing, English, Export, Commerce, Import, Microsoft Office, Operations/Management",5,7
University Registration Manager,Sinai University, Qantarah Sharq,Full Time,Manager,7+ Yrs of Exp,Ismailia,"Admission, Registration, Administration, Administration, Education/Teaching",7,9
B2B SaaS Growth Hacker,Appgain, Dokki,Full Time,Experienced,3+ Yrs of Exp,Giza,"Social Media, E-marketing, SEO, SEM, PPC, Digital Marketing, Google Analytics, Growth Hacking, English, Data Analytics",3,5
Sales Accountant - Sharqia,EGIC, Sharqia,Full Time,Entry Level,0-3 Yrs of Exp,Egypt,"Finance, Sales Accounting, Commerce, Budget, Reporting, Accounting/Finance",0,3
Sales Accountant - Qalubia,EGIC, Qalubia,Full Time,Entry Level,0-3 Yrs of Exp,Egypt,"Finance, Sales Accounting, Commerce, Budget, Reporting, Accounting/Finance",0,3
NopCommerce Web Application Support Engineer,Crystal Mind, Nasr City,Full Time,Experienced,4-6 Yrs of Exp,Cairo,"Customer Support, Information Systems, E-Commerce, English, Application Support, Information Technology (IT), Computer Science",4,6
Sales Engineer - Heliopolis,Alumil, Heliopolis,Full Time,Entry Level,1+ Yrs of Exp,Cairo,"Solar Energy, Engineering, Sales Skills, Client Relationships, Solar Sales, Account Management, Customer Service, Customer Care",1,3
Architectural Engineer - Interior Design,Signtech Communications S.A.E, Nasr City,Full Time,Experienced,3-4 Yrs of Exp,Cairo,"Engineering, AutoCAD, 3D Max, Sketchup, Decor, Interior Design, Engineering - Construction/Civil/Architecture, Creative/Design/Art",3,4
Sales Accountant - Monufya,EGIC, Monufya,Full Time,Entry Level,0-3 Yrs of Exp,Egypt,"Finance, Sales Accounting, Commerce, Budget, Reporting, Accounting/Finance",0,3
Front Desk Coordinator,Dawi Clinics, Helwan,Full Time,Entry Level,1-3 Yrs of Exp,Cairo,"Administration, Customer Service, Microsoft Office, Communication Skills, Office Management, Front Desk, MS Office, Sales Skills",1,3
Material Planning Specialist/Engineer,Masria Digital Payment (MDP), 10th of Ramadan City,Full Time,Entry Level,1-3 Yrs of Exp,Sharqia,"Material, Industrial, Planning, Supply Chain, Logistics, SAP, Logistics/Supply Chain, Purchasing/Procurement",1,3
Mechanical Material Planning Engineer,Chint Egemac, 6th of October,Full Time,Entry Level,1-3 Yrs of Exp,Giza,"Mechanical Engineering, SAP, Design, Production, Mechanical Raw Material, Raw Material Planning, Metal Drawings, English, Busbar",1,3
Sales Accountant - Alexandria,EGIC, Agami,Full Time,Entry Level,1-3 Yrs of Exp,Alexandria,"Males Only, Finance, Sales Accounting, Commerce, Budget, Reporting, Accounting/Finance",1,3
Accountant,Signtech Communications S.A.E, Nasr City,Full Time,Entry Level,1-3 Yrs of Exp,Cairo,"Finance, Accounting, Financial Analysis, Financial Management, Accounting/Finance",1,3
Medical Representative (Maadi & Helwan),So Value Pharma, Cairo,Full Time,Entry Level,1+ Yrs of Exp,Egypt,"Sales Skills, Sales Target, Customer Service, Customer Care, Customer Support, Pharmacy, Pharmaceutical, Science, Medical Sales",1,3
Clinical Sales Manager,CMR Egypt, Maadi,Full Time,Manager,5-8 Yrs of Exp,Cairo,"Sales Skills, Medical Sales, English, Clinical Sales, Medical/Healthcare, Sales/Retail",5,8
Receptionist,Mazaya, New Cairo,Full Time,Entry Level,1-3 Yrs of Exp,Cairo,"Administration, Office Management, Microsoft Office, Front Office, Secretary, English, Administration",1,3
Admin Coordinator - Alexandria,Shamy Stores, Sidi Gaber,Full Time,Experienced,2-2 Yrs of Exp,Alexandria,"Administration, Excel, Communication, Office Admin, Microsoft Office, Office Management, MS Office, Emails, MS, Administration",2,2
Full-Stack WordPress Developer,Confidential, Heliopolis,Full Time,Experienced,3-5 Yrs of Exp,Cairo,"Information Technology (IT), Computer Science, PHP, WordPress, JQuery, English, javaScript, HTML5, CSS3, Front-End",3,5
Marketing Technology Specialist,Confidential, Maadi,Full Time,Entry Level,1+ Yrs of Exp,Cairo,"Computer Science, Telecom Engineering, CRM, PHP, HTML, SQL, ERP, E-marketing, Social Media, REST, JavaScript, SOAP, Python",1,3
Graphic Designer,ExaServe LLC, Nasr City,Full Time,Experienced,2-4 Yrs of Exp,Cairo,"Graphic Design, Adobe Illustrator, Adobe Photoshop, InDesign, Creative/Design/Art",2,4
Security & Safety Supervisor,The International School of Elite Education, New Cairo,Full Time,Experienced,2+ Yrs of Exp,Cairo,"English, Security, Safety, Administration, Administration, Other",2,4
Project Sales Engineer,SOS HR Solutions, Obour City,Full Time,Experienced,3-5 Yrs of Exp,Cairo,"Industrial Engineering, Industrial Refrigeration, Sales Skills, English, Arabic, Sales/Retail",3,5
Senior Accountant (Banks & Cash),Transmar International, New Cairo,Full Time,Work From Home,3-5 Yrs of Exp,Cairo,"MS Excel, Accounting, Finance, Financial Analysis, Banking, Accounts Payable, Accounts Receivable, Accounting/Finance",3,5
Content Creator (Arabic),"Izam, inc.", Mohandessin,Full Time,Entry Level,1-3 Yrs of Exp,Giza,"SEO, ERP, Marketing, Social Media, English, Arabic, Content Writing, Microsoft Office, Translation, Writing/Editorial",1,3
Social Media Manager,Profolio Consulting, Maadi,Full Time,Manager,5-6 Yrs of Exp,Cairo,"Digital Marketing, Content Writing, Copywriting, B2B, Adobe Creative Suite, Demand Generation Marketing, Inbound Marketing, Blogging",5,6
Customer Acquisition Specialist,Confidential, Maadi,Full Time,Part Time,0-1 Yrs of Exp,Cairo,"3 Vacancies, Females Only, Communication Skills, Customer Acquisition, Voiceover, Voice-over, Operations/Management, Sales/Retail",0,1
Graphic Designer,Profolio Consulting, Maadi,Full Time,Experienced,2-3 Yrs of Exp,Cairo,"Adobe Photoshop, Adobe Illustrator, Marketing, Adobe Creative Suite, Animation, Designer, Videography, SaaS, Creative/Design/Art",2,3
Account Manager (Recruitment Background),"Izam, inc.", Mohandessin,Full Time,Experienced,2-4 Yrs of Exp,Giza,"Recruitment, English, Sourcing, Screening, Customer Service, Customer Service/Support, Human Resources",2,4
Director Executive Assistant,Confidential, Alexandria,Full Time,Experienced,2+ Yrs of Exp,Egypt,"Administration, Admin Assist, Assistant, Executive Secretary, Arabic, English, Administration",2,4
Electrical Technical Office Engineer,E&Power, 6th of October,Full Time,Entry Level,1-3 Yrs of Exp,Giza,"Electrical Engineering, AutoCAD 2D, Microsoft Office, Management, Contracting, Engineering - Mechanical/Electrical",1,3
Digital Marketing Intern,Appgain, Dokki,Internship,Entry Level,0-1 Yrs of Exp,Giza,"Google Analytics, Digital Marketing, SMM, SEO, Google Adwords, Social Media, English, Market Research, Marketing/PR/Advertising",0,1
Senior Devops Engineer,Profolio Consulting, Maadi,Full Time,Experienced,2-3 Yrs of Exp,Cairo,"Information Technology (IT), DevOps, Software Engineering, Development, Cloud Systems, Networking, IT/Software Development",2,3
ERP Software Implementer,"Izam, inc.", Mohandessin,Full Time,Experienced,3-5 Yrs of Exp,Giza,"Accounting, Information Technology (IT), Computer Science, English, ERP Implementation, Typing, Technical Support",3,5
Business Development Manager (Steel Or...,Confidential, Dokki,Full Time,Manager,15+ Yrs of Exp,Giza,"Business Development, Sales Skills, Engineering, Construction, Building Material, Export Engineer, Steel PEB, Steel Structure, Arabic",15,17
Social Media Marketing Specialist,Itroots, Mansoura,Full Time,Entry Level,1-2 Yrs of Exp,Dakahlia,"E-marketing, Digital Marketing, English, Graphic Design, Campaigns, Ads, Microsoft Office, contact mangment, Editing",1,2
Senior AP Accountant,Transmar International, New Cairo,Full Time,Experienced,3-5 Yrs of Exp,Cairo,"AP, Accounts Payable, Finance, Financial Analysis, CMA, English, Shipping, Stevedoring, Accounting/Finance",3,5
Accountant,Chint Egemac, 6th of October,Full Time,Entry Level,0-2 Yrs of Exp,Giza,"Accounting, Financial Analysis, Financial Management, Manufacturing, English, Accounting/Finance",0,2
Network Engineer,Eva Pharma, Haram,Full Time,Entry Level,0-3 Yrs of Exp,Giza,"Computer Science, Networking, Information Technology (IT), Engineering, English, Implementation, IS, IT/Software Development",0,3
Customer Service Agent,Royal Herbs, Giza,Full Time,Experienced,2-3 Yrs of Exp,Egypt,"Customer Support, Customer Care, Customer Service/Support",2,3
Senior Creative UI/UX Designer,Kick Start Interactive, Dokki,Full Time,Freelance / Project,5+ Yrs of Exp,Giza,"Information Technology (IT), Computer Science, Computer Engineering, Software Development, Web Development, Web Design, UI",5,7
Senior Java Developer,DMS, Heliopolis,Full Time,Experienced,3+ Yrs of Exp,Cairo,"Computer Science, Computer Engineering, ITI, JSF, J2EE, SE, JPA, EJB, Hibernate, Glassfish, Tomcat, Weblogic, Oracle, SVN",3,5
Marketing Head - E-Commerce,Arma, Heliopolis,Full Time,Manager,5-7 Yrs of Exp,Cairo,"Social Media, Business Administration, MBA, Aviation, Management, E-Commerce, E-marketing, Operations/Management",5,7
Customer Service Manager,Confidential, Maadi,Full Time,Manager,5+ Yrs of Exp,Cairo,"Management, Customer Service, Customer Care, Microsoft Office, Communication Skills, Business Administration, Customer Service/Support",5,7
Warehouse Admin - Dakahlia,Arma, Dakahlia,Full Time,Experienced,2-3 Yrs of Exp,Egypt,"Administration, Logistics, Transport, Distribution, AQF, Administration, Logistics/Supply Chain",2,3
Retail Sales Representative - Beheira,EGIC, Beheira,Full Time,Entry Level,0-2 Yrs of Exp,Egypt,"Sales Skills, Sales Target, Customer Services, Customer Care, Retail, Collection, Distribution, Selling Skills, Negotiation Skills",0,2
Accounts Receivable Accountant,QuadraTech for Information Technology, Katameya,Full Time,Experienced,3-5 Yrs of Exp,Cairo,"Accounting, Microsoft Office, Finance, Accounts Receivable, Financial Analysis, Microsoft Excel, Reporting, Computer Skills, English",3,5
Retail Sales Representative - Dakahlia,EGIC, Dakahlia,Full Time,Entry Level,0-2 Yrs of Exp,Egypt,"Sales Skills, Sales Target, Customer Services, Customer Care, Retail, Collection, Distribution, Selling Skills, Negotiation Skills",0,2
Procurement Planner,LG Electronics, 10th of Ramadan City,Full Time,Entry Level,1-3 Yrs of Exp,Sharqia,"SCM, Supply Chain, Engineering, CPIM, Planning, English, Computer Skills, Microsoft Office, Logistics/Supply Chain",1,3
Senior Front-End Developer,Glamera, Nasr City,Full Time,Experienced,3-7 Yrs of Exp,Cairo,"Information Technology (IT), Computer Science, Software Development, javaScript, HTML5, Front-End, CSS3, jQuery, OOP, AJAX",3,7
IT Manager,Confidential, Alexandria,Full Time,Manager,3-5 Yrs of Exp,Egypt,"Computer Science, Software Development, Configuration, Programming, Communication, Software Engineering, Project Management",3,5
Retail Sales Representative - Damietta,EGIC, Damietta,Full Time,Entry Level,0-2 Yrs of Exp,Egypt,"Sales Skills, Sales Target, Customer Services, Customer Care, Retail, Collection, Distribution, Selling Skills, Negotiation Skills",0,2
Retail Sales Representative - KafrAlsheikh,EGIC, Kafr Alsheikh,Full Time,Entry Level,0-2 Yrs of Exp,Egypt,"Sales Skills, Sales Target, Customer Services, Customer Care, Retail, Collection, Distribution, Selling Skills, Negotiation Skills",0,2
Retail Sales Representative - Gharbia,EGIC, Gharbia,Full Time,Entry Level,0-2 Yrs of Exp,Egypt,"Sales Skills, Sales Target, Customer Services, Customer Care, Retail, Collection, Distribution, Customer Service/Support",0,2
Retail Sales Representative - Monufya,EGIC, Monufya,Full Time,Entry Level,0-2 Yrs of Exp,Egypt,"Sales Skills, Sales Target, Customer Services, Customer Care, Retail, Collection, Distribution, Selling Skills, Negotiation Skills",0,2
Retail Sales Representative - Sharqia,EGIC, Sharqia,Full Time,Entry Level,0-2 Yrs of Exp,Egypt,"Sales Skills, Sales Target, Customer Services, Customer Care, Retail, Collection, Distribution, Selling Skills, Negotiation Skills",0,2
Retail Sales Representative - Qalubia,EGIC, Qalubia,Full Time,Entry Level,0-2 Yrs of Exp,Egypt,"Sales Skills, Sales Target, Customer Services, Customer Care, Retail, Collection, Distribution, Selling Skills, Negotiation Skills",0,2
Retail Sales Representative - Suez,EGIC, Suez,Full Time,Entry Level,0-2 Yrs of Exp,Egypt,"Sales Skills, Sales Target, Customer Services, Customer Care, Retail, Collection, Distribution, Selling Skills, Negotiation Skills",0,2
Procurement Section Head - Shariqa,Ahram Security Group, 10th of Ramadan City,Full Time,Experienced,4-6 Yrs of Exp,Sharqia,"Economics, Procurement, Logistics, Supplychain, Computer Skills, Engineering, Supply Chain, English, Local Purchasing",4,6
Junior Sales Representative (Retail) - Cairo,Bingo Global, Heliopolis,Full Time,Entry Level,0-3 Yrs of Exp,Cairo,"Sales Skills, Retail, Sales Target, MS Office, MS Excel, English, Microsoft Word, Sales/Retail",0,3
Retail Sales Representative - Alexendria,EGIC, Alexandria,Full Time,Entry Level,1-3 Yrs of Exp,Egypt,"Sales Skills, Sales Target, Customer Services, Customer Care, Retail, Collection, Distribution, Selling Skills, Negotiation Skills",1,3
Sales Operations Executive,Better Home, New Cairo,Full Time,Experienced,5+ Yrs of Exp,Cairo,"Real Estate, Sales Operations, Sales Skills, Property Sales, Arabic, English, CRM, Operations/Management, Sales/Retail",5,7
Retail Sales Representative - Ismalia,EGIC, Ismailia,Full Time,Entry Level,0-2 Yrs of Exp,Egypt,"Sales Skills, Sales Target, Customer Services, Customer Care, Retail, Collection, Distribution, Selling Skills, Negotiation Skills",0,2
E-commerce Manager - Retail & Household Products...,Raneen, Giza,Full Time,Manager,5-10 Yrs of Exp,Giza,"Social Media, E-marketing, Communication, Management, Logistics, Web Merchandising, Financial Analysis, Market Research, Sales/Retail",5,10
Recruitment Executive,Arma, Heliopolis,Full Time,Experienced,2+ Yrs of Exp,Cairo,"Recruitment, Microsoft Office, Communication Skills, Human Resources",2,4
UI UX Designer,Contactless, Cairo,Full Time,Experienced,3+ Yrs of Exp,Egypt,"CSS, Design, Agile, UX, UI, JS, English, Information Technology (IT), Computer Science, Creative/Design/Art, IT/Software Development",3,5
Factory Manager- Alexandria,Confidential, Bourj Alarab,Full Time,Manager,15-20 Yrs of Exp,Alexandria,"Production, Engineering, Steel Structure, Overhead Cranes, Mechanical Engineering, Civil Engineering, English, Management",15,20
Purchasing Executive,Arma, Heliopolis,Full Time,Entry Level,1-3 Yrs of Exp,Cairo,"Logistics, Commerce, Business Administration, English, Raw Material, SAP, Local Purchasing, Logistics/Supply Chain",1,3
Operations Manager,Egyptian Company for Trading Industry and International Agents, 6th of October,Full Time,Manager,5-15 Yrs of Exp,Giza,"Operations, Communication, Analytical, Sales, Operations/Management, Sales/Retail",5,15
Fashion Designer,Leadintop, Maadi,Full Time,Part Time,1-3 Yrs of Exp,Cairo,"1-3 Yrs of Exp, 4 Vacancies, Females Preferred, Fashion Design, Sketches, Style, Fine Arts, Creative/Design/Art, Fashion",1,3
Key Accounts Sales Admin,Talabat, Maadi,Full Time,Entry Level,1-3 Yrs of Exp,Cairo,"Sales Skills, Sales Target, Marketing Campaigns, Customer Service, Customer Care, Account Managment, Customer Relations, English",1,3
Account Manager -Upper Egypt,Talabat, Beni Suef,Full Time,Entry Level,1-3 Yrs of Exp,Beni Suef,"Sales Skills, Sales Target, Marketing Campaigns, Customer Service, Customer Care, Account Managment, Customer Relations, English",1,3
Sales Executive - Edtech,Innovito, Nasr City,Full Time,Experienced,2-4 Yrs of Exp,Cairo,"Sales Target, IT Solutions, B2B Sales, Corporate Sales, Customer Service, Customer Care, Customer Support, Marketing, IT Sales",2,4
Senior Front End Developer - React,GetTechForce.com, Cairo,Full Time,Experienced,5+ Yrs of Exp,Egypt,"Redux, ReactJS, Front-End, Javascript, Information Technology (IT), Computer Science, CSS, English, IT/Software Development",5,7
Backend Developer - Full Time,ElMnassa Innovation & Development, New Cairo,Full Time,Entry Level,1+ Yrs of Exp,Cairo,"Fix Bugs, Coding, Information Technology (IT), PHP, Programming, Software Engineering, HTML, Backend, JSON, Web Development",1,3
Fluent English Customer Service Agent - (Maadi),Xceed, Maadi,Full Time,Entry Level,1-2 Yrs of Exp,Cairo,"Customer Service, English, Customer Care, Customer Support, Native, Communication Skills, Customer Service/Support, Sales/Retail",1,2
Junior Cost Manager,Gleeds Construction Consultancy, Maadi,Full Time,Entry Level,0-2 Yrs of Exp,Cairo,"Construction Engineering, Research, Business Development, Engineering - Construction/Civil/Architecture, Business Development",0,2
Graphic Designer - Intern,CityNet, Cairo,Internship,Entry Level,0-1 Yrs of Exp,Egypt,"Adobe Photoshop, Adobe Illustrator, Marketing Campaigns, GIF, Adobe Indesign, Creative/Design/Art, Media/Journalism/Publishing",0,1
Access To Finance Specialist (Egyptian Nationals...,JE Austin Associates, Cairo,Full Time,Experienced,7+ Yrs of Exp,Egypt,"Project Management, Business Analysis, English, Arabic, Agriculture Finance, Financial Institutions, Financial Services, Marketing",7,9
Telesales Agent,Travel Sawa, Nasr City,Full Time,Entry Level,1-2 Yrs of Exp,Cairo,"Sales Skills, Sales Target, Communication Skills, Computer Skills, Customer Service, Customer Care, Customer Support, Telesales",1,2
Sales Representative (Outdoor) - 6th Of October,MeshKah Studio, 6th of October,Full Time,Entry Level,1-2 Yrs of Exp,Giza,"Sales Skills, Outdoor Sales, Sales Target, Marketing, Digital Marketing, Production, Sales/Retail",1,2
Junior Proposal Engineer,RMS, Mohandessin,Full Time,Entry Level,0-2 Yrs of Exp,Giza,"Electrical Engineering, Instrumentation, PLC, Automation Sales, Microsoft Office, Indoor Sales, Mechanical Engineering, Gas Analysis",0,2
Senior Account Manager/Digital Marketing...,Glu solutions, Fleming,Full Time,Experienced,5+ Yrs of Exp,Alexandria,"Advertising, Social Media Platforms, E-marketing, English, Marketing/PR/Advertising, Sales/Retail, Media/Journalism/Publishing",5,7
Testing Lead,ITIDA, 6th of October,Full Time,Manager,7+ Yrs of Exp,Giza,"Information Technology (IT), Software Development, Project Management, Quality Assurance, Computer Science, Software Testing, Quality",7,9
Mobile Developer,ITIDA, 6th of October,Full Time,Experienced,5+ Yrs of Exp,Giza,"Information Technology (IT), Mobile Development, Software Development, Computer Science, Information Systems, IT/Software Development",5,7
DevOps Engineer,ITIDA, 6th of October,Full Time,Experienced,5+ Yrs of Exp,Giza,"Computer Science, Software Development, Information Systems, DevOps, English, IT/Software Development",5,7
Office Manager,Confidential, Cairo,Full Time,Experienced,2-5 Yrs of Exp,Egypt,"Office Management, Administration, Secretary, Real Estate, Office Manager, Microsoft Office, Communication Skills, CEO, English",2,5
R&D Hardware Engineer,LG Electronics, 10th of Ramadan City,Full Time,Experienced,2-4 Yrs of Exp,Sharqia,"Manufacturing, Mechatronics, Electrical, Hardware, Electronics, R&D, R&D/Science, Installation/Maintenance/Repair",2,4
R&D Mechanical Engineer,LG Electronics, 10th of Ramadan City,Full Time,Experienced,2-4 Yrs of Exp,Cairo,"Mechanical Engineering, Mechatronics, R&D, 2D, 3D, Mechanical Power, Hardware, Troubleshooting, R&D/Science",2,4
Interior Design/Architecture Team Leader,Confidential, New Cairo,Full Time,Manager,7+ Yrs of Exp,Cairo,"Architecture, Engineering, Shop Drawings, Revit, Commercial Construction, Contractor, 3ds Max, Photoshop, AutoCAD, Fine Arts",7,9
Exchange Administrator,Confidential, New Cairo,Full Time,Experienced,4-6 Yrs of Exp,Cairo,"Information Technology (IT), System Administration, PowerShell, Network, Exchange Administration, Backup, Lotus Notes, MSCE",4,6
Senior Software Engineer Full Stack,Meddy, Dubai,Full Time,Work From Home,5-10 Yrs of Exp,United Arab Emirates,"Computer Science, Software Development, Software Engineering, DevOps, Information Technology (IT), Software Design",5,10
Site Engineer,Lotus Finishing Materials, Nozha,Full Time,Experienced,3-4 Yrs of Exp,Cairo,"Construction, Architecture, Drawings, Revit, AutoCAD, Engineering - Construction/Civil/Architecture",3,4
Senior PHP Developer,Togar, New Nozha,Full Time,Experienced,3-7 Yrs of Exp,Cairo,"PHP, Information Technology (IT), Software Development, CSS, Computer Science, javaScript, MySQL, HTML, OOP, AJAX, WordPress",3,7
Systems Engineer,Sumerge, Cairo,Full Time,Experienced,3-5 Yrs of Exp,Egypt,"Computer Science, FileNet, DevOps, HTTP, Installation, Software Engineering, Application Server, LDAP, Linux",3,5
Sales Manager,Confidential, Abbassia,Full Time,Manager,7-15 Yrs of Exp,Cairo,"Customer Service, Sales Target, Business, Negotiation Skills, textile, fabric, Leadership, B2B, Communication, Business Development",7,15
UI/ UX Developer,Add Pluses, 6th of October,Full Time,Freelance / Project,1-2 Yrs of Exp,Giza,"Males Only, HTML5, CSS3, Web Development, Web Design, Software Development, javaScript, UI, UX, Adobe Photoshop, jQuery",1,2
CRM Consultant,Xceed, Maadi,Full Time,Work From Home,2+ Yrs of Exp,Cairo,"Information Technology (IT), Computer Science, IT, Configuring, Computer Software, English, Customer Support, CRM, C#, SQL",2,4
Web Graphic Designer,Dimofinf Operations Center, Nasr City,Full Time,Experienced,4-5 Yrs of Exp,Cairo,"Adobe Photoshop, Adobe Illustrator, Creative, Graphics, Web Design, Social Media, Fine Arts, English, Adobe XD, Zeplin",4,5
Senior Property Consultant - Sales Real Estate,Casa Blanca for real estate investment, New Cairo,Full Time,Entry Level,1-4 Yrs of Exp,Cairo,"Sales Skills, Real Estate, Sales Target, Senior Sales, Insurance, Advertising, Communication Skills, Media, Negotiation Skills",1,4
Account Manager (indoor sales),Transmar International, New Cairo,Full Time,Work From Home,4-8 Yrs of Exp,Cairo,"Customer Service, Sales Target, Customer Service/Support, Sales/Retail",4,8
IT Help Desk Specialist,Confidential, Cairo,Full Time,Experienced,2-4 Yrs of Exp,Egypt,"Information Technology (IT), Computer Science, Help Desk, Installation, Customer Service, English, Computer Engineering, Computer Hardware",2,4
Digital Marketing Specialist,Orchidia Pharmaceutical Industries, Cairo,Full Time,Experienced,3+ Yrs of Exp,Egypt,"Digital Marketing, E-marketing, Online Marketing, Marketing/PR/Advertising, Media/Journalism/Publishing",3,5
ERP Application Consultant,Rednet It Services, Cairo,Full Time,Experienced,3-7 Yrs of Exp,Egypt,"ERP, Accounting, Microsoft SQL Server, C#.Net, Software Development, Software Engineering, Computer Science, IT",3,7
Data Cabling Site Engineer,QuadraTech for Information Technology, Katameya,Full Time,Experienced,3-7 Yrs of Exp,Cairo,"Site Engineer, Infrastructure, EPON, GPON, Computer Science, Telecommunication, Engineering, AutoCAD, Microsoft Visio, SCS, Lan Tester",3,7
Business Development Executive (Software),iHorizons, Maadi,Full Time,Work From Home,3-5 Yrs of Exp,Cairo,"Business Development, Sales Skills, Communication Skills, IT, English, Computer Science, Information Technology, Sales Target",3,5
