Title,Company,Location,Type,Level,YearsExp,Country,Skills,MinYearsExp,MaxYearsExp
Digital Marketing Supervisor,Elsaba AutoService, New Cairo,Full Time,Experienced,6-8 Yrs of Exp,Cairo,"Social Media, SEO, Advertising, SEM, Google Adwords, E-marketing, Automotive, Marketing/PR/Advertising",6,8
Senior Graphic Designer,Elsaba AutoService, New Cairo,Full Time,Experienced,6-8 Yrs of Exp,Cairo,"Adobe Illustrator, Adobe Photoshop, Marketing, Social Media, Creative, Advertising, Fine Arts, InDesign, In design, DreamWeaver",6,8
Technical Support Specialist,Spinneys Egypt, 6th of October,Full Time,Entry Level,0-2 Yrs of Exp,Giza,"Information Technology (IT), Computer Hardware, Computer Systems, Software, Installation, Configuration, Computer Maintenance",0,2
Senior Digital Media Buyer,4level1, Maadi,Full Time,Experienced,3-5 Yrs of Exp,Cairo,"Digital Marketing, SEO, Google Adwords, Media Buying, Advertising, Facebook, Communication Skills, Campaigns, ROI",3,5
Call Center Representative,Universal Payment Services, Nasr City,Full Time,Entry Level,1+ Yrs of Exp,Cairo,"Customer Service, Customer Support, Call Center, English, Customer Care, Arabic, Communication Skills, Customer Service/Support",1,3
Payable Senior Accountant,Nile Air, Sheraton,Full Time,Experienced,5-7 Yrs of Exp,Cairo,"Accounts Payable, Tax, SAP, Financial Analysis, English, Computer Skills, MS Office, Accounting Software, Accountant, Auditing",5,7
Sr. Business Developer,Premier Services and Recruitment, Maadi,Full Time,Experienced,2-5 Yrs of Exp,Cairo,"Sales, Business Analysis, Management, Advertising, Business Administration, Business Development, Marketing/PR/Advertising",2,5
Localization Project Coordinator,The Translation Gate, Maadi,Full Time,Entry Level,1-2 Yrs of Exp,Cairo,"Translation, Business, Microsoft Office, Microsoft Windows, Analysis, Writing, Project Management, Localization, Project Coordination",1,2
Retail Sales Representative,Heggy Group, Heliopolis,Full Time,Shift Based,1+ Yrs of Exp,Cairo,"3 Vacancies, Sales Skills, Customer Service, Retail, Microsoft Office, Indoor Sales, Sales Target, English, Customer Service/Support",1,3
Accountant,Heggy Group, Heliopolis,Full Time,Entry Level,1-4 Yrs of Exp,Cairo,"Commerce, Corporate Finance, Financial Analysis, Financial Management, Accounting/Finance",1,4
PR & Marketing Manager,AMACO, 6th of October,Full Time,Manager,3+ Yrs of Exp,Giza,"Public Relations (PR), Social Media, Advertising, Events, Online Marketing, Marketing/PR/Advertising, Media/Journalism/Publishing",3,5
Fresh Graduates,Bayt El Khebra, Maadi,Full Time,Entry Level,0-3 Yrs of Exp,Cairo,"English, Microsoft Office, Accounting/Finance, Administration, Human Resources",0,3
HR Generalist,AMACO, 6th of October,Full Time,Experienced,3-7 Yrs of Exp,Giza,"Human Resources (HR), HR, Hiring, Contracts, Human Resources",3,7
SEO Intern,Upper Medic, Cairo,Internship,Entry Level,0 Yrs of Exp,Egypt,"SEO, Digital Marketing, Social Media, Content, Research, Communications Engineering, Marketing/PR/Advertising",0,2
Junior Accountant,Cecil Intelligent Childhood, Obour City,Full Time,Entry Level,1+ Yrs of Exp,Cairo,"Accounting, Odoo ERP, Accounting/Finance",1,3
Social Media Moderator,Confidential, New Cairo,Full Time,Experienced,2-3 Yrs of Exp,Cairo,"E-marketing, SEO, Content, Copywriting, Online Marketing, Communication, Management, Creative, Marketing/PR/Advertising",2,3
Videographer And Video Editor,iPROTK, Nasr City,Full Time,Experienced,3+ Yrs of Exp,Cairo,"Sales Target, Business Development, Video Editing, Videography, Adobe After Effects, Creative/Design/Art",3,5
Full Stack Developer,ISEC, Nasr City,Full Time,Experienced,3-4 Yrs of Exp,Cairo,"Computer Science, Software Development, javaScript, Node.js, OOP, AWS, MySQL, IT/Software Development",3,4
Digital Marketing Officer,International Committee of Red Cross, Maadi,Full Time,Experienced,4-8 Yrs of Exp,Cairo,"Social Media, Microsoft Office, SEO, Advertising, English, Business Development, Google Analytics, Creative/Design/Art",4,8
General Accountant,Cecil Intelligent Childhood, Obour City,Full Time,Experienced,3-5 Yrs of Exp,Cairo,"Accounting, Finance, ERP System, Financial Management, Accounting/Finance",3,5
Factory Manager,AMACO, 6th of October,Full Time,Manager,7+ Yrs of Exp,Giza,"Production, Management, Aluminum, Curtain Walling, Quality, Fabrication, Operations/Management, Manufacturing/Production",7,9
Regional Junior AP Accountant,Aptec, Obour City,Full Time,Entry Level,1+ Yrs of Exp,Cairo,"Accounting, Finance, Commerce, AP, Accounts Payable, English, Accounting/Finance",1,3
Power BI Developer,Global Brands, 6th of October,Full Time,Experienced,3+ Yrs of Exp,Giza,"Power BI, BI, Business Intelligence, Computer Science, SQL, DAX, Engineering, IT/Software Development",3,5
Social Networking Intern,AMACO, 6th of October,Internship,Entry Level,0 Yrs of Exp,Giza,"Social Media, Marketing, Social Networking, PR, Marketing/PR/Advertising, Media/Journalism/Publishing",0,2
Frontend Developer,KnowledgeNet, Nasr City,Full Time,Entry Level,1+ Yrs of Exp,Cairo,"CSS3, Design, Bootstrap, RESTful, AJAX, Information Technology (IT), Computer Science, Software Development, javaScript",1,3
Senior Accountant - Account Receivables,Madinet Nasr for Housing and Development, Nasr City,Full Time,Experienced,3-6 Yrs of Exp,Cairo,"Accounts Receivable, Accounting, Accounting/Finance",3,6
Front Desk Specialist,Madinet Nasr for Housing and Development, Nasr City,Full Time,Entry Level,1-2 Yrs of Exp,Cairo,"Front Desk, Administration, Microsoft Office, Office Management, Communication Skills, Administration, Customer Service/Support",1,2
Receptionist / Sales Assistant,Ghabbour Auto, Cairo,Full Time,Entry Level,1-3 Yrs of Exp,Egypt,"Females Only, Administration, Receptionist, Sales Admin, Customer Service, Customer Care, Administration, Customer Service/Support",1,3
Operations Coordinator,3D Diagnostix, Maadi,Full Time,Entry Level,0-1 Yrs of Exp,Cairo,"Healthcare, Medical, Production, Operations, Agriculture, Science, Engineering, Nutrition, Operations/Management",0,1
Technical Lead,NGMSA, Alexandria,Full Time,Manager,10+ Yrs of Exp,Egypt,"Software Development, Computer Science, Software Engineering, Computer Engineering, C#, C++, Visual Studio, English",10,12
Customer Service Agent,Confidential, Heliopolis,Full Time,Shift Based,1-2 Yrs of Exp,Cairo,"Males Only, Customer Service, Customer Support, Customer Care, Call Center, Customer Service/Support",1,2
Procurement Coordinator,Mamiba, 6th of October,Full Time,Entry Level,1-3 Yrs of Exp,Giza,"Procurement, Microsoft Office, Communication Skills, Purchasing/Procurement",1,3
Accountant,Confidential, Mansoura,Full Time,Entry Level,2-3 Yrs of Exp,Dakahlia,"Accounting, Finance, Financial Analysis, Financial Management, English, SAP, Microsoft Office, Accounting/Finance",2,3
Outdoor Sales Representative,Smart Get, Cairo,Full Time,Part Time,0-5 Yrs of Exp,Egypt,"0-5 Yrs of Exp, 5 Vacancies, Outdoor Sales, Sales Target, Sales Skills, Communication Skills, English, Sales/Retail",0,5
Customer Service Agent - Travel Adviser,Flairstech, Maadi,Full Time,Entry Level,1-2 Yrs of Exp,Cairo,"Tourism, Customer Service, Customer Support, Customer Care, Sales, Customer Satisfaction, Customer Inquiries, Customer Complaints",1,2
IT Help Desk Agent,New Plan, New Cairo,Full Time,Experienced,2-4 Yrs of Exp,Cairo,"Information Technology (IT), Installation, Information System, Help Desk, English, Computer Science, IT, Software Engineering",2,4
Payroll & Personnel Specialist,Mohamed and Ramy, Cairo,Full Time,Entry Level,1-3 Yrs of Exp,Egypt,"Human Resources (HR), Recruitment, Management, English, Personnel, Communication, Excel, Human Resources",1,3
Senior Administration Officer,INDEVCO, 6th of October,Full Time,Experienced,3-5 Yrs of Exp,Giza,"Secretary, Office Management, Microsoft Excel, Microsoft Office, Microsoft Word, Microsoft PowerPoint, Accounting, MS Office",3,5
Sales Consultant,MG Developments, Nasr City,Full Time,Entry Level,1+ Yrs of Exp,Cairo,"Real Estate Sales, Property Sales, Commercial Real Estate, Coastal, English, Sales Skills, Sales/Retail",1,3
Business Development & Digital Sales Specialist,WellGrow Training and Consulting, Maadi,Full Time,Entry Level,1-2 Yrs of Exp,Cairo,"Business Development, Sales Target, Communication Skills, Problem Solving, Creative, Digital Sales, Business Development, Sales/Retail",1,2
Promoter ( El Minya ),Confidential, Minya,Full Time,Entry Level,1-3 Yrs of Exp,Egypt,"Promotion, PR, Sales, Customer Support, Customer Satisfaction, Events, Workshop, Customer Service/Support, Marketing/PR/Advertising",1,3
Procurement Engineer,TTC Technologies, Heliopolis,Full Time,Entry Level,1-3 Yrs of Exp,Cairo,"Procurement, Logistics, Engineering, Telecommunication, Mechatronics, Microsoft Office, Electronics, Medical, English",1,3
Product Designer (UX Designer),GET Group- Egypt, Sheraton,Freelance / Project,Experienced,4+ Yrs of Exp,Cairo,"Photoshop, XD, Art, OmniGraffle, Axure, Cinema 4D, Lightwave, Maya, 3D, Typographical, CSS, HTML 5, UX",4,6
Export Area Manager,Confidential, Alexandria,Full Time,Manager,5-7 Yrs of Exp,Egypt,"MBA, Logistics, Supply Chain, Export, English, Arabic, Logistics/Supply Chain",5,7
Digital Marketing Executive,Chloride, Abu Rawash,Full Time,Experienced,3+ Yrs of Exp,Giza,"Digital Marketing, Social Media, SEO, English, Communication, Management, Presentation Skills, Online Marketing",3,5
Web Developer,Pillars, Hadayek Alahram,Full Time,Experienced,3+ Yrs of Exp,Giza,"HTML/CSS, Information Technology (IT), Computer Science, Quality, Web Development, PHP, ASP.NET, IT/Software Development",3,5
Outdoor Sales Representative - Gharbia,Penguin, Gharbia,Full Time,Experienced,3+ Yrs of Exp,Egypt,"Sales Skills, Outdoor Sales, Sales Target, Home Appliances, Excel, Communication Skills, Sales/Retail",3,5
Outdoor Sales Representative - Sharqia,Penguin, Sharqia,Full Time,Experienced,3+ Yrs of Exp,Egypt,"Sales Skills, Outdoor Sales, Sales Target, Home Appliances, Excel, Communication Skills, Sales/Retail",3,5
Senior MS Exchange Engineer,"Roaya IT Solutions,", Maadi,Full Time,Experienced,7+ Yrs of Exp,Cairo,"SCOM, Software Development, ITIL, PMP, MCSE, VMWare, Linux, Information Technology (IT), Computer Science, Computer Skills",7,9
Export Documentation Coordinator,Confidential, Alexandria,Full Time,Experienced,3-5 Yrs of Exp,Egypt,"Documentation, Logistics, Supply Chain, Shipping, Orders, English, Logistics/Supply Chain",3,5
Senior Full Stack Developer (.NET),DEVOPSolution, Nasr City,Full Time,Experienced,5+ Yrs of Exp,Cairo,".NET Development, Computer Science, Computer Engineering, Information Technology (IT), C#, MVC, ASP.NET, Angular, Typescript, HTML5",5,7
Mechanical Engineer,Tiger Marine, Badr City,Full Time,Experienced,2-4 Yrs of Exp,Cairo,"Mechanical Engineering, Maintenance, Electrical Engineering, Technical Drawings, Installation/Maintenance/Repair",2,4
Web Chat Customer Service Agent,The Hair Addict, New Cairo,Full Time,Work From Home,1+ Yrs of Exp,Cairo,"Customer Support, Typing, Customer Service, Web Chat, Customer Service/Support",1,3
Corporate Sales Manager (Insurance),Egyptian Life Takaful, Cairo,Full Time,Manager,9-12 Yrs of Exp,Egypt,"Corporate Sales, Sales Target, English, Commerce, Business, Economics, Microsoft Office, Insurance, Sales/Retail",9,12
Sales Representative,Apexos Group, Sheraton,Full Time,Entry Level,1+ Yrs of Exp,Cairo,"Customer Service, F&B, B2B, Sales Skills, Sales Target, Customer Service/Support, Sales/Retail",1,3
Fashion Designer,Egyptian Company for Trading Industry and International Agents, Haram,Full Time,Experienced,3+ Yrs of Exp,Giza,"Fashion, Design, Audaces, Patterns, Creative/Design/Art, Fashion",3,5
Java Backend Developer,Entrepreware, Maadi,Full Time,Entry Level,1-2 Yrs of Exp,Cairo,"GIT, Java, CSS3, MYSQL, Hibernate, Backend, Software Engineering, Computer Science, Information Technology (IT), Software Development",1,2
Admissions Officer,El Sewedy Education, Cairo,Full Time,Entry Level,1-3 Yrs of Exp,Egypt,"Higher, Education, Administration, Microsoft Office, Office Management, Communication Skills, Administration, Other",1,3
UI/UX Designer,Confidential, Nasr City,Full Time,Experienced,3+ Yrs of Exp,Cairo,"UI, UX, Web Design, Adobe Photoshop, HTML5, CSS3, Javascript, Adobe Illustrator, InVision, Sketch, UXPin, Flinto, Prototypes",3,5
"Procurement Manager, META",Acino Pharma Egypt, New Cairo,Full Time,Manager,10+ Yrs of Exp,Cairo,"Purchasing, Supply Chain, Microsoft Office, Logistics/Supply Chain, Purchasing/Procurement",10,12
Warehouse Supervisor (Chemicals) - (Ù…Ø´Ø±Ù? Ù…Ø®Ø§Ø²Ù†...,EVA Cosmetics, 6th of October,Full Time,Experienced,3+ Yrs of Exp,Giza,"Logistics, Supply Chain, Store Management, Science, Agriculture, Commerce, R&D/Science, Logistics/Supply Chain",3,5
Senior Financial Controller - Alexandria,Prometeon Pirelli Tyres ( Ex-Pirelli ), Ameria,Full Time,Experienced,4-8 Yrs of Exp,Alexandria,"SAP, Finance, Accounting, Financial Analysis, Cost Control, CMA, Commerce, Financial Management, Accounting/Finance",4,8
Senior UI Developer,Fawry Banking & Payment Technology Services, 6th of October,Full Time,Experienced,4-6 Yrs of Exp,Giza,"Bootstrap, javaScript, jQuery, CSS3, HTML5, Information Technology (IT), Computer Science, Computer Engineering, Software Development",4,6
Technical Sales Account Manager - Software,Confidential, Cairo,Full Time,Experienced,2+ Yrs of Exp,Egypt,"Business Development, Information Technology (IT), Lead Generation, Forcasting, Sales Target, Customer Service, Account Management",2,4
Marketing Internship - Smart Village Cairo,Prometeon Pirelli Tyres ( Ex-Pirelli ), Smart Village,Internship,Entry Level,0-1 Yrs of Exp,Giza,"Online Marketing, Advertising, Digital Marketing, Social Media, Business Development, Marketing/PR/Advertising, Analyst/Research",0,1
Telesales Executive,4level1, Cairo,Full Time,Entry Level,1-3 Yrs of Exp,Egypt,"Startup, Telesales, Online Support, Sales Skills, Customer Service, Sales Target, Customer Service/Support, Sales/Retail",1,3
Accountant,RO creative studio, Nasr City,Full Time,Entry Level,1-3 Yrs of Exp,Cairo,"Finance, Microsoft Office, Financial Analysis, Computer Skills, English, Accounting/Finance",1,3
Business Developer,HPA (Highly Professional Advisors), New Cairo,Full Time,Entry Level,1-3 Yrs of Exp,Cairo,"Sales Target, English, Corporate Sales, B2B, Education, E-learning, Learning Software, Business Administration, Business Development",1,3
Senior Business Analyst,Titan Cement Egypt, Sheraton,Full Time,Experienced,4+ Yrs of Exp,Cairo,"Economics, Computer Science, SAP BO Suite, Power BI, ERP, English, Arabic, Information Technology (IT), Communication Skills",4,6
Social Media Specialist,RO creative studio, Nasr City,Full Time,Experienced,2-5 Yrs of Exp,Cairo,"Social Media, E-marketing, Writing, Content Creation, Writing/Editorial, Marketing/PR/Advertising, Media/Journalism/Publishing",2,5
Graphic Designer,RO creative studio, Nasr City,Full Time,Experienced,2-5 Yrs of Exp,Cairo,"Graphic Design, Adobe Photoshop, Adobe Illustrator, Marketing, Branding, After Effects, Creative/Design/Art",2,5
Graphic Design Instructor,Mishkat Nour, Port Said,Part Time,Experienced,4-7 Yrs of Exp,Egypt,"Adobe Illustrator, Adobe Photoshop, Instructor, Adobe Premiere, Teaching, Creative/Design/Art, Training/Instructor",4,7
Outdoor Sales Representative,Penguin, Cairo,Full Time,Experienced,3+ Yrs of Exp,Egypt,"Sales Skills, Outdoor Sales, Sales Target, English, Home Appliances, Excel, Sales/Retail",3,5
Sales Executive - Trucking Industry,Confidential, Giza,Full Time,Experienced,2+ Yrs of Exp,Egypt,"Logistics, Lead Generation, Transportation, Trucks, B2B, Sales Skills, Sales Target, Business Development, Logistics/Supply Chain",2,4
Senior Property Consultant,Makanak, New Cairo,Full Time,Experienced,3-5 Yrs of Exp,Cairo,"Females Only, Sales Team, Sales Target, Sales Skills, Communication Skills, Presentation Skills, Management, Training, English",3,5
Electrical Procurement Engineer,Samman Engineering & Consulting, Dokki,Full Time,Experienced,5-8 Yrs of Exp,Giza,"Procurement, Electrical Engineering, Logistics, Supply Chain, Logistics/Supply Chain, Purchasing/Procurement",5,8
Senior Vendor Manager,Teqneyat, Mohandessin,Full Time,Experienced,3+ Yrs of Exp,Giza,"Vendor Manager, Vendor Management, Translation, English, Human Resources, Project/Program Management",3,5
Senior QA Engineer,Wadi Degla Group, Maadi,Full Time,Experienced,6-8 Yrs of Exp,Cairo,"Quality Assurance, Architectural Engineering, Engineering - Construction/Civil/Architecture, Quality",6,8
Social Media Specialist - Real Estate,Confidential, Cairo,Full Time,Experienced,2-5 Yrs of Exp,Egypt,"Social Media, Digital Marketing, E-marketing, Advertising, Social Networking, Sales Skills, Customer Service, Real Estate Sales",2,5
Fashion Buyer - Denim,Confidential, Giza,Full Time,Experienced,5-7 Yrs of Exp,Egypt,"Merchandising, Design, Denim, Fashion, Purchasing/Procurement",5,7
Front End Developer,Simple Touch Software, Cairo,Full Time,Work From Home,3-5 Yrs of Exp,Egypt,"Front End Developer, HTML5, jQuery, JavaScript, CSS3, AngularJs, user experience, Computer Science, Information Technology (IT)",3,5
Android & iOS Flutter Developer,Confidential, Maadi,Full Time,Experienced,5+ Yrs of Exp,Cairo,"Information Technology (IT), Software Development, Android Design, Computer Science, GIT, Offline Storage, UI, Android SDK, flutter",5,7
Competitive Intelligence Officer,Misr Elkheir Foundation, Cairo,Full Time,Experienced,3-5 Yrs of Exp,Egypt,"Analysis, Project Management, Planning, Accounting/Finance, Business Development, Analyst/Research",3,5
IT Help Desk Specialist,Raya Contact Center, Smart Village,Full Time,Shift Based,0-2 Yrs of Exp,Giza,"5 Vacancies, Information Technology (IT), Help Desk, IT, Computer Science, Technical, Installation, Telecom, Computer Engineering",0,2
Business Analysis Officer,Misr Elkheir Foundation, Mokattam,Full Time,Experienced,3-5 Yrs of Exp,Cairo,"Excel, Finance, Accounting/Finance, Business Development, Analyst/Research",3,5
Office Manager/Accountant,Apexos Group, Sheraton,Full Time,Experienced,3+ Yrs of Exp,Cairo,"Finance, Financial Management, Financial Analysis, Excel, HR, Administration, F&B, Accounting/Finance, Administration",3,5
Quran Teacher,Mishkat Nour, Port Said,Part Time,Experienced,3-7 Yrs of Exp,Egypt,"Education, Teaching, International School, Quran, Education/Teaching",3,7
Quality & Innovation Director,Apexos Group, Sheraton,Full Time,Experienced,2-9 Yrs of Exp,Cairo,"Quality, Business Development, Photoshop, Illustrator, F&B, Business Development, Quality",2,9
Lab Analyst,scitra, 6th of October,Full Time,Experienced,2-4 Yrs of Exp,Giza,"Science, Quality Control, Pharmacy, Lab Analyst, GED, RPM, FG, COAs, FMCG, Cosmetics, R&D/Science, Analyst/Research",2,4
Math Teacher,Mishkat Nour, Port Said,Part Time,Experienced,3-7 Yrs of Exp,Egypt,"Education, Teaching, International School, English, Teacher, Mathematics, Education/Teaching",3,7
Art Teacher,Mishkat Nour, Port Said,Part Time,Experienced,3-7 Yrs of Exp,Egypt,"Education, Teaching, International School, English, Art, Creative, Creative/Design/Art, Education/Teaching",3,7
Digital Marketing Executive,Confidential, Heliopolis,Full Time,Experienced,2+ Yrs of Exp,Cairo,"Digital Marketing, Social Media, SEO, Facebook, Photoshop, Campaigns, Brokerage, Real estate, Communication, Creative, Management",2,4
Admin Assistant,Abdelkader Clinic, Sheikh Zayed,Full Time,Experienced,3+ Yrs of Exp,Giza,"Customer Service, Customer Care, Customer Support, Office Management, Secretary, Microsoft Office, Medical, Clinic Management",3,5
Science Teacher,Mishkat Nour, Port Said,Part Time,Experienced,3-7 Yrs of Exp,Egypt,"Education, Teaching, International School, English, Science, Education/Teaching",3,7
Sales Supervisor Home Appliances - Zagazig,Confidential, Zagazig,Full Time,Manager,6+ Yrs of Exp,Sharqia,"Males Only, Sales Management, Sales Plan, Sales Target, Sales Skills, Sales Home Appliances, Communication Skills, Home Appliances Sales",6,8
Senior Internal Auditor,Misr Elkheir Foundation, Mokattam,Full Time,Experienced,3-5 Yrs of Exp,Cairo,"Accounting, Finance, Auditing, Accounting/Finance, Banking",3,5
Sr. Lighting Sales Engineer,Elsewedy industries, New Cairo,Full Time,Experienced,3-7 Yrs of Exp,Cairo,"Sales Skills, Engineering, Electrical, Lighting Products, Sales/Retail, Engineering - Mechanical/Electrical",3,7
Senior Web Developer,Glamera, Nasr City,Full Time,Experienced,3+ Yrs of Exp,Cairo,"Web Development, Computer Science, Computer Engineering, Information Technology (IT), HTML5, CSS3, ASP.NET MVC, Restful Web API",3,5
CRM Officer,Gila Electric, Downtown,Full Time,Experienced,2+ Yrs of Exp,Cairo,"CRM, Call Center, Customer Service, Customer Care, Customer Support, Communication Skills, Analysis, Presentation Skills, Odoo",2,4
Sales Admin (Telesales),Location Real Estate, Nasr City,Full Time,Entry Level,1-3 Yrs of Exp,Cairo,"Realestate, Resale, Cold Calls, Brokerage Real Estate, Property, Administration, Telesales, Customer Service, Administration",1,3
Operations Specialist / Sales Admin (Brokerage...,Location Real Estate, New Cairo,Full Time,Experienced,2-4 Yrs of Exp,Cairo,"Females Only, Skills, CRM, Resale, Brokerage Real Estate, Microsoft Excel, Sales Admin, Administration, Operations/Management",2,4
Resale Property Consultant,Location Real Estate, New Cairo,Full Time,Experienced,2+ Yrs of Exp,Cairo,"Males Preferred, Real Estate, Resale, Brokerage, Sales Skills, Property Sales, Sales Target, Sales/Retail",2,4
Senior Resale Agent - Brokerage,Confidential, New Cairo,Full Time,Experienced,3-10 Yrs of Exp,Cairo,"Males Preferred, Primary, Sales Skills, Brokerage Real Estate, Resale, Sales/Retail",3,10
Senior Property Consultant - Real Estate,Confidential, New Cairo,Full Time,Experienced,2+ Yrs of Exp,Cairo,"Males Preferred, Primary, Real Estate Sales, Sales Skills, Brokerage Real Estate, Sales Target, English, Sales/Retail",2,4
Property Consultant - Brokerage,Location Real Estate, Heliopolis,Full Time,Entry Level,1-3 Yrs of Exp,Cairo,"Sales Skills, Property Sales, Brokerage Real Estate, Sales Target, English, Sales/Retail",1,3
Marketing Executive/ Sales Admin,Location Real Estate, Heliopolis,Full Time,Experienced,2-3 Yrs of Exp,Cairo,"Real Estate, SEO, Creative, Content writing, Adobe Photoshop, Property, Writing/Editorial, Marketing/PR/Advertising",2,3
Arabic Teacher,Mishkat Nour, Port Said,Part Time,Experienced,3-7 Yrs of Exp,Egypt,"Teacher, Education, Education/Teaching",3,7
Video Editor & Animator - New Cairo,Confidential, New Cairo,Full Time,Work From Home,5-7 Yrs of Exp,Cairo,"Video Editing, Motion Graphics, Adobe Premiere, Animation, After Effects, Adobe Photoshop, Creative, Creative/Design/Art",5,7
Delivery & Administrative Coordinator,SMART Furniture, Sheraton,Full Time,Experienced,2-4 Yrs of Exp,Cairo,"Administrative, Administration, Delivery, Logistics, Retail, MS Office, Administration, Logistics/Supply Chain",2,4
HR Specialist ( Personnel ),Mersal, Maadi,Full Time,Experienced,2+ Yrs of Exp,Cairo,"Human Resources (HR), Personnel, Microsoft Office, HR, English, HR Diploma, Labor Laws, Employment, Interviewing, Selecting",2,4
Python Back End Developer,Div Systems, Mokattam,Full Time,Entry Level,1-3 Yrs of Exp,Cairo,"Information Technology (IT), Software Development, Computer Science, Software Engineering, javaScript, HTML5, Front-End, SQL",1,3
IT System Administrator,Elabd Foods, Sharabeya,Full Time,Experienced,4-6 Yrs of Exp,Cairo,"Computer Science, MCSE, MCSA, Information Technology (IT), System Administration, Computer Engineering, Telecom, Maintenance, Repair",4,6
Sales Advisor (Telesales)-Fluent English only,3D Diagnostix, Maadi,Full Time,Entry Level,0-3 Yrs of Exp,Cairo,"Sales Skills, Sales Target, Customer Service, English, Telesales, Customer Care, Customer Service/Support, Sales/Retail",0,3
Security/Penetration Tester,Caelum Middle East, Dokki,Full Time,Experienced,2-4 Yrs of Exp,Giza,"Application Security, Application Architecture, Communication Protocols, IT/Software Development, Quality",2,4
Senior Internal Auditor,Confidential, New Cairo,Full Time,Experienced,8+ Yrs of Exp,Cairo,"Computer Skills, Finance, Accounting, Internal Auditing, Financial Management, Financial Analysis, Microsoft Word, Accounting/Finance",8,10
Social Media Coordinator,Pink'n Green, Hadayek Alahram,Full Time,Entry Level,0-3 Yrs of Exp,Giza,"E-marketing, SEO, Digital Marketing, Sales Skills, Sales Target, Microsoft Office, Marketing/PR/Advertising",0,3
Sales Assistant (Seasonal),Shamy Stores, Alexandria,Full Time,Freelance / Project,0-1 Yrs of Exp,Egypt,"Sales Skills, Indoor Sales, Sales Target, Outdoor Sales, Microsoft Office, Video Games, Customer Service, Retail, Sales/Retail",0,1
Personnel Specialist,Confidential, Sheikh Zayed,Full Time,Experienced,2-4 Yrs of Exp,Giza,"Males Only, Personnel, Human Resources (HR), HRIS, Microsoft Office, Recruitment, HR, Training, MS Office, Employment, Labor Law",2,4
Operations Manager - Cairo,Mishkat Nour, Nasr City,Full Time,Manager,4-7 Yrs of Exp,Cairo,"Communication Skills, Operations Management, Leadership, Operations/Management",4,7
Export Sales Account Manager â€“ Gulf Area,Kandil Industries, Cairo,Full Time,Experienced,2-4 Yrs of Exp,Egypt,"Sales Skills, Customer Service, Sales Target, English, Food And Beverage, Account Management, Export Sales, Logistics/Supply Chain",2,4
Sales Engineer - Chemical Cleaners Div.,Inter-Tech, Heliopolis,Full Time,Experienced,3-5 Yrs of Exp,Cairo,"Cleaners and Chemicals, Sales, Engineering, R&D/Science, Sales/Retail, Engineering - Other",3,5
English Teacher (National - International),Mishkat Nour, Port Said,Part Time,Experienced,3-7 Yrs of Exp,Egypt,"Education, Teaching, International School, English, Education/Teaching",3,7
